ID,name,type,quantity,cost,effect
WS-021,チェーンリローダー,Mechanism,3,2,自分のターン終了時、自分のデッキを1つ選び、上から2枚公開する。\nその中から1枚を自分の機銃1つに裏向きで装填し、残りを手札に加える。
WS-022,ファストリロード,Action,4,1,カードを3枚引く。\n自分の機銃1つに手札からカードを1枚表か裏向きに装填する。\n〈ファストリロード〉は1ターンに1度しか発動できない。
WS-025,ガード&リロード,Reaction,3,1,HIT-3。\n自分のデッキ1つを選び、その上から1枚を公開する。そのカードを自分の機銃1つに表か裏向きで装填してもよい。\nそうしない場合、手札に加える。
WS-016,マキシマムガード,Reaction,2,2,このターン中、自分に与えられるHITを全て0にする。
WS-024,モード：ファランクス,Mechanism,2,1,【オーバークロック】\n自分の〈継型機関連銃モウリョウ〉を裏向きにする。そうした場合、以下の効果を解決する。\n- 自分のターン終了時、相手に5HIT。その後、自分のデッキを1つ選び、その上からカードを5枚捨て札に置く。場にあるこのカードは捨て札に置かれない。
WS-027,リカバリー,Action,3,0,自分のボルテージを確認し、その中からカードをX枚まで選び、捨て札に置く。その後回復X。
WS-023,スピンシールド,Mechanism,3,0,相手の射撃によって与えられるHIT-1。
