ID,name,type,quantity,cost,effect
42,反物質光弾,SpecialBullet,4,0,このカードを装填した機銃の射撃時、相手のデッキを1つ選び、その上から1枚捨て札に置く。
44,閃光幕,Reaction,3,1,相手の射撃または技能によって与えられるHIT-2。\n捨て札から【行動】を1枚手札に加える。
45,爆砕光線,Action,2,2,相手の装填、【機能】、またはセットされているカードから合計2枚捨て札に置く。
43,撹乱光線,Action,3,0,相手は手札からカードを2枚捨て札に置く。\nその後、相手はカードを1枚引く。
47,多重力光球,Mechanism,1,1,相手の射撃によって3HIT以上与えられる時、HITを与えられる代わりにこのカードをデッキの下に置くことができる。
48,過負荷光球,Mechanism,3,0,自分のターン開始時、相手のデッキを1つ選び、その上から1枚捨て札に置く。
41,計略,Action,3,1,カードを3枚引く。
46,亜空光線,Action,1,2,(追加コスト：〈核熱式反物質粒子砲 ウワン〉の装填3を捨て札に置く)\n相手のデッキを1つ選び、その上から5枚捨て札に置く。\nカードを5枚引く。
